{
  "schema_version": "1.0.0",
  "ir_hash": "sha256:example",
  "mode": "canonical",
  "renderer": {
    "id": "canonical",
    "version": "0.1.0",
    "model": null,
    "rule_registry_hash": "sha256:example"
  },
  "text": "Let f be a function from alpha to beta. Assume that f is injective. Then f is injective.",
  "speech": null,
  "clauses": [
    {
      "id": "c1",
      "text": "Let f be a function from alpha to beta.",
      "node_ids": [
        "n_f"
      ],
      "kind": "formal",
      "confidence": null
    },
    {
      "id": "c2",
      "text": "Assume that f is injective.",
      "node_ids": [
        "n_h"
      ],
      "kind": "formal",
      "confidence": null
    },
    {
      "id": "c3",
      "text": "Then f is injective.",
      "node_ids": [
        "n_goal"
      ],
      "kind": "formal",
      "confidence": null
    }
  ],
  "loss": {
    "covered": [
      "n_f",
      "n_h",
      "n_goal"
    ],
    "compressed": [],
    "elided": [],
    "unrendered": [],
    "exact_coverage": 1.0,
    "effective_coverage": 1.0
  },
  "faithfulness_status": "exact_structural",
  "disagreements": [],
  "warnings": [],
  "provenance": {}
}
